{
  "id": "SOMA-BJ-000000",
  "declarant": {
    "id_contributeur": "CTB-000000",
    "type": "technicien"
  },
  "consentement": {
    "obtenu": true,
    "date": "2026-10-05",
    "mode": "oral"
  },
  "localisation": {
    "precision": "gps",
    "lat": 6.3703,
    "lon": 2.3912,
    "precision_m": 10,
    "pays": "BJ",
    "region": "Littoral",
    "commune": "Cotonou",
    "quartier": "Exemple"
  },
  "type_installation": "usage_productif",
  "usages": [
    "eclairage",
    "commerce_artisanat",
    "ventilation"
  ],
  "puissance_pv_wc": 400,
  "batterie": {
    "chimie": "lifepo4",
    "tension_v": 12.8,
    "capacite_ah": 100
  },
  "onduleur_w": 500,
  "equipements": [
    {
      "composant": "kit_tout_en_un",
      "marque": "Exemple",
      "modele": "X1000"
    }
  ],
  "paygo": true,
  "etat": "en_service",
  "date_installation": "2026-09",
  "source": "declaration"
}